{
  "id": "antd",
  "name": "Ant Design",
  "type": "app",
  "description": "Ant Design system for Next.js",
  "framework": "nextjs",
  "env": {
    "VITE_ANTD_THEME": {
      "validation": "z.string()",
      "default": "dark",
      "side": "client",
      "description": "Ant Design theme"
    }
  }
}
