{
  "id": "shadcn",
  "name": "Shadcn UI",
  "type": "app",
  "description": "Shadcn UI design system for Vite",
  "framework": "vite",
  "env": {
    "VITE_SHADCN_THEME": {
      "validation": "z.string()",
      "default": "zinc",
      "side": "client",
      "description": "Shadcn UI color theme"
    }
  }
}
