{
  "id": "antd",
  "name": "Ant Design",
  "type": "design-system",
  "description": "Ant Design system for Vite",
  "framework": "vite",
  "env": {
    "VITE_ANTD_THEME": {
      "validation": "z.string()",
      "default": "dark",
      "side": "client",
      "description": "Ant Design theme"
    }
  }
}
